{
  "$schema": "https://json-schema.org/draft/2020-12/schema",
  "$id": "https://nexus.cleantechhub.net/schema/datalab-teaser.json",
  "title": "Datalab teaser",
  "type": "object",
  "additionalProperties": false,
  "required": ["contract_status", "gtm_status", "company", "gaps"],
  "properties": {
    "contract_status": {
      "const": "to agree with the Datalab desk"
    },
    "gtm_status": {
      "const": "GTM hypothesis"
    },
    "status": {
      "enum": ["ready", "no_report"]
    },
    "draft": { "type": "boolean" },
    "csoReady": { "type": "boolean" },
    "accessed_on": { "type": "string" },
    "scope": { "type": "string" },
    "company": {
      "type": "object",
      "additionalProperties": false,
      "required": ["name", "country", "persona", "profile_source_url", "profile_quote"],
      "properties": {
        "name": { "type": "string" },
        "legal_name": { "type": "string" },
        "country": { "const": "Colombia" },
        "persona": { "enum": ["cso", "esg_reporting", "procurement"] },
        "working_sector": { "type": "string" },
        "theme_id": {
          "enum": [
            "banking_insurance",
            "energy_utilities",
            "oil_gas",
            "food_consumer",
            "construction"
          ]
        },
        "wave": { "type": "integer" },
        "profile_source_url": { "type": "string", "minLength": 1 },
        "profile_quote": { "type": "string", "minLength": 1 },
        "profile_page_pdf": { "type": "integer" },
        "report_listing_url": { "type": "string" },
        "bvc_listed": { "type": ["boolean", "null"] },
        "bvc_evidence_quote": { "type": "string" },
        "bvc_evidence_page_pdf": { "type": "integer" },
        "gri_report_url": { "type": ["string", "null"] }
      }
    },
    "gaps": {
      "type": "array",
      "maxItems": 5,
      "items": { "$ref": "#/$defs/gap" }
    }
  },
  "allOf": [
    {
      "if": {
        "properties": { "status": { "const": "no_report" } },
        "required": ["status"]
      },
      "then": {
        "properties": {
          "gaps": { "maxItems": 0 }
        }
      }
    },
    {
      "if": {
        "not": {
          "properties": { "status": { "const": "no_report" } },
          "required": ["status"]
        }
      },
      "then": {
        "properties": {
          "gaps": { "minItems": 1 }
        }
      }
    }
  ],
  "$defs": {
    "gap": {
      "type": "object",
      "additionalProperties": false,
      "required": [
        "gap_id",
        "rank",
        "title",
        "theme_id",
        "journey_step",
        "startup_stage",
        "statement",
        "evidence_url",
        "evidence_quote",
        "matches"
      ],
      "properties": {
        "gap_id": { "type": "string", "minLength": 1 },
        "rank": { "type": "integer", "minimum": 1, "maximum": 5 },
        "title": { "type": "string", "minLength": 1 },
        "theme_id": {
          "enum": [
            "banking_insurance",
            "energy_utilities",
            "oil_gas",
            "food_consumer",
            "construction"
          ]
        },
        "journey_step": {
          "enum": ["challenge", "policy", "hubs", "data", "partnerships", "capital"]
        },
        "startup_stage": {
          "enum": ["Pre-Seed", "Seed", "Pre-Series A", "Series B+"]
        },
        "statement": { "type": "string", "minLength": 1 },
        "evidence_url": { "type": "string", "minLength": 1 },
        "evidence_quote": { "type": "string", "minLength": 1 },
        "report_page_printed": { "type": "string" },
        "report_page_pdf": { "type": "integer" },
        "gri_topic_standard": { "type": "string" },
        "gri_disclosure_in_report": { "type": "string" },
        "supporting_quote": { "type": "string" },
        "supporting_quote_page_pdf": { "type": "integer" },
        "matches": {
          "type": "array",
          "minItems": 1,
          "maxItems": 5,
          "items": { "$ref": "#/$defs/match" }
        },
        "shortfall": { "type": "boolean" }
      }
    },
    "match": {
      "type": "object",
      "additionalProperties": false,
      "required": [
        "match_id",
        "actor_kind",
        "name",
        "claim_type",
        "public_source_url",
        "public_quote"
      ],
      "properties": {
        "match_id": { "type": "string", "minLength": 1 },
        "actor_ref": { "type": "string" },
        "actor_kind": { "enum": ["startup", "funder"] },
        "name": { "type": "string", "minLength": 1 },
        "description": { "type": "string" },
        "location": { "type": "string" },
        "website": { "type": "string" },
        "startup_stage": {
          "enum": ["Pre-Seed", "Seed", "Pre-Series A", "Series B+"]
        },
        "claim_type": { "enum": ["theme_match", "actor_relation"] },
        "why": { "type": "string" },
        "public_source_url": { "type": "string", "minLength": 1 },
        "public_quote": { "type": "string", "minLength": 1 },
        "relation_type": { "type": "string" },
        "accessed_on": { "type": "string" }
      }
    }
  }
}
